{
  "schemaVersion": 2,
  "slug": "2026-08-31-weekly-marketing-digest",
  "date": "2026-08-31",
  "title": "Weekly marketing intelligence",
  "summary": "Illustrative structure for decision-useful Mellanni guidance and broader ecommerce signals.",
  "topics": [
    "Profitability",
    "Creator commerce"
  ],
  "actions": [
    {
      "id": "protect-margin-test",
      "title": "Keep the next growth test inside the private margin guardrail",
      "externalSignal": "Operators are increasingly evaluating channel growth on contribution rather than attributed revenue alone.",
      "sourceIds": [
        "operator-source"
      ],
      "memory": {
        "outcome": "no-relevant-record",
        "comparison": "The bounded memory search found no record specific enough to change this illustrative decision.",
        "decisionImpact": "Use the fresh private Mellanni evidence as the decision basis.",
        "privateEvidenceRefs": []
      },
      "mellanniEvidence": {
        "entityScope": "Illustrative portfolio / ASIN B012345678 / campaign SP-BRAND-042",
        "conclusion": "Synthetic portfolio evidence shows $1.25M in sales and 31% contribution efficiency over the trailing 28 days, supporting an efficiency-first test.",
        "source": "Mellanni first-party reporting",
        "window": "Trailing 28 days, America/Los_Angeles",
        "grain": "Portfolio and day",
        "privateQueryRefs": [
          "query-protect-margin"
        ],
        "rawEvidenceWithheld": true
      },
      "privateDecision": {
        "entityIds": [
          "illustrative-private-portfolio"
        ],
        "baseline": "Illustrative contribution efficiency is 31 percent over the trailing 28 days.",
        "guidance": "Run one bounded growth test inside the measured portfolio guardrail.",
        "kpi": "Contribution efficiency and qualified demand",
        "successCondition": "Promote the test if contribution efficiency improves to 26 percent or better while qualified demand stays within 5 percent of baseline.",
        "stopCondition": "Stop if contribution efficiency reaches 34 percent or inventory coverage falls below 21 days."
      },
      "guidance": "Run one bounded channel test while keeping contribution efficiency at 31% or better.",
      "timebox": "Two weekly review cycles",
      "kpi": "Contribution efficiency and qualified demand",
      "successCondition": "Promote if contribution efficiency reaches 26% or better while qualified demand stays within 5% of baseline.",
      "stopCondition": "Stop if contribution efficiency reaches 34% or inventory coverage falls below 21 days.",
      "confidence": "medium",
      "limitations": [
        "All checked-in metrics and identifiers are synthetic."
      ],
      "novelty": {
        "status": "novel"
      },
      "skillReferences": [
        {
          "uri": "mellanni://skills/source-routing",
          "applicability": "Choose the first-party source that owns each required business metric.",
          "requiredInputs": [
            "entity scope",
            "metric",
            "time window"
          ],
          "intendedNextOperation": "Route the approved test readback to the correct Mellanni provider."
        }
      ]
    }
  ],
  "signals": [
    {
      "id": "creator-commerce-signal",
      "title": "Creator commerce is becoming a discovery layer",
      "externalSignal": "Creator-led commerce is expanding beyond direct conversion into product discovery and later demand capture.",
      "sourceIds": [
        "creator-source"
      ],
      "memory": {
        "outcome": "consistent",
        "comparison": "The external signal is consistent with the selected historical record on separating discovery from measured conversion.",
        "decisionImpact": "Keep the signal in the digest, but do not call it a Mellanni result without a bounded validation test.",
        "privateEvidenceRefs": [
          "memory-creator-commerce"
        ]
      },
      "whyItMatters": "This may affect creative, attribution, and demand-capture choices across ecommerce channels, not only Amazon.",
      "nextValidation": "Define a small creator-content holdout and query branded demand plus downstream conversion before promoting this signal to an Action.",
      "novelty": {
        "status": "novel"
      },
      "skillReferences": [
        {
          "uri": "mellanni://skills/helium10-research",
          "applicability": "Check whether external discovery coincides with measurable branded or category search movement.",
          "requiredInputs": [
            "seed keywords",
            "marketplace",
            "comparison window"
          ],
          "intendedNextOperation": "Run bounded keyword discovery and compare it with first-party demand evidence."
        }
      ]
    }
  ],
  "sources": [
    {
      "id": "operator-source",
      "name": "Illustrative operator source",
      "url": "https://example.com/operator-economics",
      "note": "Illustrative direct evidence URL; replace with a real source in an actual digest."
    },
    {
      "id": "creator-source",
      "name": "Illustrative creator-commerce source",
      "url": "https://example.com/creator-commerce",
      "note": "Illustrative direct evidence URL; replace with a real source in an actual digest."
    }
  ],
  "isSample": true
}
